level,word,definition,example
B1,achieve,to succeed in doing something,She worked hard to achieve her goal.
B1,advice,an opinion that helps someone decide,My teacher gave me good advice.
B1,although,used to show contrast,Although it rained we went out.
B1,benefit,a good result or advantage,Exercise has many benefits.
B1,challenge,a difficult task,Learning grammar can be a challenge.
B1,compare,to look at differences and similarities,Compare these two answers.
B1,confident,sure about your ability,She feels confident speaking English.
B1,develop,to grow or become better,You can develop your vocabulary.
B1,effort,hard work,Success needs effort.
B1,experience,knowledge from doing something,He has experience as a teacher.
B1,improve,to become better,My English is improving.
B1,instead,in place of something else,I drank tea instead of coffee.
B1,manage,to succeed in doing something difficult,Did you manage to finish the work?
B1,notice,to see or become aware of something,I noticed a mistake in the text.
B1,opinion,what someone thinks about something,What is your opinion about this book?
B1,purpose,the reason for doing something,The purpose of this lesson is practice.
B1,realize,to understand something clearly,I realize this is important.
B1,require,to need something,This job requires English skills.
B1,support,to help someone,My friends support me.
B1,valuable,very useful or important,Practice is valuable for learners.
